{
  "scene_id": "scene-intro",
  "name": "Intro",
  "transition_ms": 1500,
  "objects": [
    {
      "object_id": "1VA",
      "x": -58.98720846824625,
      "y": 69.26872060111666,
      "z": -22.614972426398325,
      "size": 25.0,
      "gain": -6.0,
      "mute": false,
      "algorithm": "default"
    },
    {
      "object_id": "1VB",
      "x": 36.2685056161539,
      "y": 46.247236226116655,
      "z": -82.93212618768455,
      "size": 25.0,
      "gain": 0.0,
      "mute": false,
      "algorithm": "default"
    },
    {
      "object_id": "1VC",
      "x": 1.7799823952908582,
      "y": 78.26953125,
      "z": -77.02565057006481,
      "size": 25.0,
      "gain": 0.0,
      "mute": false,
      "algorithm": "default"
    },
    {
      "object_id": "1VD",
      "x": -77.35220003587165,
      "y": 69.2373046875,
      "z": -39.01707219994047,
      "size": 25.0,
      "gain": 0.0,
      "mute": false,
      "algorithm": "default"
    },
    {
      "object_id": "VA1",
      "x": 59.95646028145506,
      "y": 0.0,
      "z": 72.45331629332892,
      "size": 25.0,
      "gain": 0.0,
      "mute": false,
      "algorithm": "default"
    },
    {
      "object_id": "VA2",
      "x": -57.53992567277085,
      "y": 0.0,
      "z": 62.66288433684878,
      "size": 25.0,
      "gain": 0.0,
      "mute": false,
      "algorithm": "default"
    },
    {
      "object_id": "VA3",
      "x": 50.70280526771491,
      "y": 0.0,
      "z": 12.472924090336846,
      "size": 25.0,
      "gain": 0.0,
      "mute": false,
      "algorithm": "default"
    },
    {
      "object_id": "obj-1",
      "x": 12.128554148016306,
      "y": 0.0,
      "z": 28.05227515609141,
      "size": 25.0,
      "gain": 0.0,
      "mute": false,
      "algorithm": "default"
    }
  ]
}
